{
  "files": {
    "paper/analysis-plan.md": "4121a62cb2cf266711bc00331d87a440e8dc6b3c407e0c68a76282cf9cfd0c5f",
    "paper/analysis.json": "74e974dffd7e810e6cc1061b71bc40860617b3bf52c271b311f9e7a57c46e187",
    "paper/models.json": "6e04b8b96b32b8189939500a8c8950db11b85e9e2b56ad2c0cd8024585d44239",
    "paper/prompts/abox-repair.txt": "0de399367b1f2793be2442eb17facf23d25e5254df9e442157d5eaebaa952c7c",
    "paper/prompts/tbox-taxonomy-patch.txt": "df071d522e4ef5dd5a7112c831455b95f9c3c7ce175d51fac86e609c59549b92",
    "paper/prompts/track-diagnosis.txt": "103a487995115d5c8ccc0b70d4b65987f9c63e3cdf4e9a073b572b685bc859ad",
    "paper/protocol.json": "482c19719580ff51071f381c85f914bbd1d65b37354fddd0957e6247d1aa735b",
    "paper/selection-policy.json": "4b9e8d757a7bcffcfda12903971105b865a35fbff1c1beebb922726bcd042cdd",
    "pyproject.toml": "ec6b6fb9dcf1d7d8e7153095e3e832fcc9dd3f63b24ae917c63cc73c7d953e39",
    "schemas/abox-response.schema.json": "e889a8a184336aef6bee1e1087974403b0cbc655c07110970d0892ccb8a8cf12",
    "schemas/analysis-contrast.schema.json": "4a0296a0909dd58abf636b231c05c7015be7af2c875ea1bbaa29dcb67287aa06",
    "schemas/analysis-diagnosis.schema.json": "543914e3585dd1fdcf92c3e008e706130b8cd2a9b7ea1ef26172930c3aafe159",
    "schemas/analysis-estimate.schema.json": "2383547e7ce2ab7f4646b6f8f73b12ab13dcd453296f4e043e3864a160aa457f",
    "schemas/analysis-result-manifest.schema.json": "c07f07e276e72d094cfc1d083eff88d56c88ec4cb51df452cdd84b1d3f592e4f",
    "schemas/analysis-summary.schema.json": "9dd50e4432bd9c883b4b659a7c278ee4265ab6fb04f8b4d344f6840be49fdd54",
    "schemas/artifact-lineage.schema.json": "f0aac9840b208624ed3559a8836d12b160bfce454782ed03ada02346ec211123",
    "schemas/audit-disposition.schema.json": "21a60235aa703bcbc8554376071babc764c34ba03d6c33821e0bf54c1178ab14",
    "schemas/audit-summary.schema.json": "78cfa9cd9ea3d8fc15b04e8465ffbf34a724ba8579d2fb3f67f5e5e156acda46",
    "schemas/audit-workflow.schema.json": "6285e0ba8de60e6b4884ead9b843fa0a7c0eab801c9b5af697d37e604669c621",
    "schemas/automated-audit-review.schema.json": "2ecef932bfad2f26dfbc78f28411a9ad3a1e46fcbcd09b361bf2987b2cacb49f",
    "schemas/automated-audit.schema.json": "c8291d7b26ab0f372e8ddef9e6b95a04a807571985bf214d97de0ca684798fbf",
    "schemas/dataset-case.schema.json": "07565d1c5d3cde74dd5a52b8c2a3edc3e69e28e2b194f5f951f4024b1dc9f763",
    "schemas/dataset-manifest.schema.json": "b906a43418f51d0c56fe40d74cedf5864779b2976cd517e5d0d5f8bc8340abc8",
    "schemas/eligibility-order.schema.json": "192bc3a013b503adabf886530cae9d1ee03ff5604f3223468693c66a5865039f",
    "schemas/evaluation-replay.schema.json": "9bbf034e03df89bf520e90017625f348674bb4f907c5612d7fe45605dcd461ad",
    "schemas/experiment-matrix.schema.json": "78cc38a0f4d7cb31fb7c45162a45610ceae788b8f9eed8f41ab2dd7e35a02b95",
    "schemas/experiment.schema.json": "7084d151dd31f9b39c447ce1d1adb95623b065fdac24454a2bf9041ff5ca203b",
    "schemas/few-shot-support.schema.json": "05dab06d3485d1b54b1779fac7cffd0abff28838778952159d20197a78e385f3",
    "schemas/generation-record.schema.json": "84db94ee0fbf3f3db6d564fbf00e85a6531dec712aacbc4dda82f4314c605786",
    "schemas/group-exclusions.schema.json": "6fc68bcd6ca1e8b0fbfe26f8ae3bd5d1826ac458c98c9830dfdc57d263358be5",
    "schemas/matrix-cell.schema.json": "98c1f21d94d7ae15206000f37aaaaaad632f2ac860e9300ff0d399f33d181e19",
    "schemas/matrix-request.schema.json": "16510f4bef6c6d45dcd52d33bf991ce75a948662c25542a1dccd5ef7ef5c7dc0",
    "schemas/methodology-lock.schema.json": "770312534f67cfbab7803b6e9f2b1b0bdf5c665ae9325b51449c59fcf3d1c480",
    "schemas/methodology.schema.json": "0c2a353d973dcc6b1ba57434273a52f7dd2d2c36770aa5cf00282238a2303995",
    "schemas/model-matrix.schema.json": "6aa4fed545e09368fd2e9164f4a0380406acdf335598edd2de28ad6b300e8a2f",
    "schemas/per-case-eligibility.schema.json": "188685af693ef8bafc4e3c893f1d7aecca027a2b723d7e122e1dc9f5eb9a6373",
    "schemas/rendered-audit-prompt.schema.json": "be579aa4301a1306aa3f424d6573397c1ad5e04e488dd7fc42757a5c2d914389",
    "schemas/reserve-manifest.schema.json": "9343a7f68049c56e0ba1af0c0d50e530217f466d68a19c62c119f16dc9978620",
    "schemas/selection-manifest.schema.json": "44ed245cd4fd04f70b930eb0309db3b46e26887a48c0629cd0d64cd39a8461d6",
    "schemas/selection-prompt-audit.schema.json": "4c550e09c1641176934513b9c34b1d9a74e7c810bd1dc28b5b7e8c19b4fb3583",
    "schemas/selection-ranking.schema.json": "fcb0ff80fcbb4d72f5326880175737a89554a63e5ad8b53cb40630c35134c7e7",
    "schemas/selection-replacement.schema.json": "17be44d20ad217deef2f18938028aefdac5bbcd405809e849bf85b3c02e8c0f0",
    "schemas/selection-workflow.schema.json": "5e2da791b7daf175bcf29ce48b180aa0d1dee22e02fb9dea4ee066e77e166d89",
    "schemas/source-candidate.schema.json": "fe7877699a198019314b67087474e6fc3672f7be43d84ce1a671eadcc1d3e54b",
    "schemas/source-popularity.schema.json": "f27ca3bf71e477458fa4aec42c9a4a152a7428deeecda7dfc6b12460c4b6d0d2",
    "schemas/source-provenance.schema.json": "8de5400a8afe50812460136541ff9004fea08e96335f07f131fc86ba8dbff969",
    "schemas/source-repair.schema.json": "1295eb24b25a449dbd732b346c7555f552af6eb8f7abcefc80a05958c22d5656",
    "schemas/support-bank.schema.json": "753e7c1952ae40862747f3ae85ad64232bde1d835e7a9fcb0dd5f2d5433e45e0",
    "schemas/tbox-response.schema.json": "43a3ecc3c469f9b931ca43f79c54d7e1976d11b180b35cd0a9c902d61963eac7",
    "schemas/track-diagnosis-response.schema.json": "6ab0bd842d9f302e71ffdfc4338020e3edaf7996c1b904d84ec9b734428620c1",
    "schemas/world-state-record.schema.json": "a034c5d15c5ea2cf9cf3f753507b94180da908e84d2c9eaeee545b699843fe61",
    "src/artifact_lineage.py": "404df2552096b0c9416267ce3ea262df275b0e313ce624ecbffde4b53915e9ef",
    "src/automated_audit_codex.py": "9e93b11ce49fb6bf7a1074b1ba63d0d550b2f0c37bffd52c28a29f37e5084c02",
    "src/automated_consistency_audit.py": "34d3104d98e03f97e719c77711eab8c42c3442664149b992032b12d9f44d370c",
    "src/classifier.py": "2f719e60376bf972efa761d5b33fec163a3e4d57928476d88afcc52be543949c",
    "src/fetcher.py": "0c3774ec8a7899509f8de72458c23fa6bfc681022718b44633ee7fd57ddd7b2e",
    "src/guardian/__init__.py": "a4f7977ff2b1777f55cba9f57cbd9d1a37c5d9692fc8e44afa550dd33bb329b4",
    "src/guardian/common.py": "999bd3994f20c66eb96cbc78be4d65e8c3f5940ad062ba605f6fb2d2b5563c06",
    "src/guardian/evaluator.py": "c1c9d232105b8c39dc848a829705769deb8f7f1a82a1eac8fd75a93093170906",
    "src/guardian/generation_cache.py": "94a901f4b5d29e72972624c23e5a9798b81f128b5ce567c019711abae468e858",
    "src/guardian/model_provider.py": "be0c9c4714792b726b9a8d9cf37f73e8e91fe75597e8786a648d0efcc7438a04",
    "src/guardian/patch_parser.py": "69718101be5c30401af4c318a1a7fd9f30ae461ed7c63486c4a482ad4569d7f1",
    "src/guardian/prompts.py": "6715e59635c6d1334bbe46d8c652100c0d47d380c5397070a86a2c84ecdf8bb2",
    "src/guardian/reasoning.py": "6899ff69bae72b7697749ee03ee5dd95038982ef8f148e70cbf8fc8258c8232b",
    "src/guardian/tbox_parser.py": "aee31c73d7f1b111caec307284b51f5a142d749b00f83371f89b430c220a49ca",
    "src/guardian/tbox_taxonomy_patch_evaluator.py": "8516cb29b2c60be8e65e7dac25757e8c5ea23bc71e0ed362e60949ed27ba9462",
    "src/guardian/tbox_taxonomy_patch_parser.py": "05e4e9de35dd0a94dbb9410403f52c1f5867e902a94e0a6459839425bc6b7777",
    "src/guardian/tbox_taxonomy_patch_run.py": "29630e66f82cf68802e863644902944e7fa1091ae36c3bfa0f06907c5b125fd9",
    "src/guardian/track_parser.py": "48e1396179948e69844ef232ebd5916d004c65f953415fdedb816167b236b365",
    "src/kg_benchmark/__init__.py": "4ad71c9cdcd981cf971846c612fa4b4fdf2be4e0f0eb713b670aeecc9b75cd3b",
    "src/kg_benchmark/analysis/__init__.py": "331b68b0e8e9522ce029a40f494ba18558c57173794dc7c4a4b27dd98027697e",
    "src/kg_benchmark/analysis/statistics.py": "82b0e98794c7d4b71cdd5e132182f40dd69c5ad6dd07ae5be8e53885d423bcea",
    "src/kg_benchmark/analysis/workflow.py": "e75c8dbcc18c5541a6e2c305974990865e70e10b041e543f7bba3e67c01fb881",
    "src/kg_benchmark/audit/__init__.py": "23b1ba9ec333f4859119ec6e6561f9488b899ad55803ee40fba5cf2a3bb5e7be",
    "src/kg_benchmark/audit/workflow.py": "b726e7e1287550d9a94667df259ab8023db01fd92b3bbb76cf34f8f9d12411bf",
    "src/kg_benchmark/cli.py": "9bb43cd7f369a6953eca8dee31f5197445baeb7bd171891c36eb34bf7c7b7f98",
    "src/kg_benchmark/dataset/__init__.py": "a6730c053caf5e19958299378416e7682c118814eaec0c244c0fbb0fa3a2b1f2",
    "src/kg_benchmark/dataset/gates.py": "43e7c55f847551858ce7a3e6ac7f794cbcadfeabea6aefb4c4832dd31b6d7b75",
    "src/kg_benchmark/dataset/release.py": "066127e944299c660a678b785109241cdfa8ed81ee5ceb66e8ee5ab7d9c426c9",
    "src/kg_benchmark/matrix/__init__.py": "82d86e4cdbc56ca84ca4e3199740037b44d32539bb534914370631a42f413240",
    "src/kg_benchmark/matrix/workflow.py": "2ea5dbd484da0109a0d3f5a9ab3ceda9ec25d28f9e7cd2a8bc4597ffe404b913",
    "src/kg_benchmark/methodology.py": "47abde49cfa4d358f923674260f2f36443e189f8d4029c046169f158b616e3d4",
    "src/kg_benchmark/resources.py": "ea2f2b360f4c9480fbb8b993ad370083635db6eaa238f2a4d6a330e76da3e5a3",
    "src/kg_benchmark/selection/__init__.py": "363e6c091886d765c716b1394858b9252ffa3054bcbc1e40dd45bf33ba993baa",
    "src/kg_benchmark/selection/extensible.py": "56cc8b697b5cc1603709746f01e9dcc21279fd5c6cfc556bb9c2ae8766721acd",
    "src/kg_benchmark/selection/workflow.py": "38f6284d13fc11299328fecb263919bf056bdeb36c064d913bf736c0886868b4",
    "src/lib/__init__.py": "ba4389dff98c11da4134fdc2880ebc498f7c7a9c9ab72f6679c1227ed67cd3a5",
    "src/lib/benchmark_selection.py": "4ca9f9c797533eb635fcd859416b40da68c60225b8354541a11d8e5287689ab4",
    "src/lib/cache_sqlite.py": "bac98cb74fefc1c83a62ebd039e56ff8b0427b1fd0ef85bdb938877df75b226f",
    "src/lib/caching.py": "3baf2e2ba490fe865683936c5b5568b3368de4bb67825747c3678ec2732e88dd",
    "src/lib/config.py": "852ad1b09b38827e226c7783be36c0e25d1ea1ce63f76acfd1db99ad6b9aa502",
    "src/lib/env.py": "3843e93da181baec786a92a380aeeed37b6d0c643ebef2794c17eb6f966e36f9",